{
  "schema_version": 1,
  "meta": {
    "name": "Sine Wave Fly"
  },
  "patch": [
    {
      "type": "spot",
      "id_range": [
        1,
        24
      ]
    }
  ],
  "layout": {
    "type": "generator",
    "generator": {
      "shape": "matrix",
      "rows": 1,
      "columns": 24,
      "spacing": 30,
      "origin": [
        0,
        0
      ]
    }
  },
  "groups": [
    {
      "id": "all",
      "name": "All",
      "fixtures": {
        "range": [
          1,
          24
        ]
      },
      "sort_by": "x"
    }
  ],
  "phasers": [
    {
      "id": "sine_fly",
      "name": "Sine Fly",
      "target": "all",
      "multiplier": 1,
      "steps": [
        {
          "values": {
            "tilt": -60,
            "dimmer": 1,
            "color": "#00aaff"
          },
          "width": 50,
          "transition": 100,
          "accel": 30,
          "decel": -30
        },
        {
          "values": {
            "tilt": 60,
            "dimmer": 0.2,
            "color": "#001144"
          },
          "width": 50,
          "transition": 100,
          "accel": -30,
          "decel": 30
        }
      ],
      "phase": {
        "mode": "spread",
        "spread": {
          "from": 0,
          "to": 100
        }
      }
    }
  ],
  "timeline": {
    "events": []
  }
}
