{
  "schema_version": 1,
  "meta": {
    "name": "Pyramid Stage"
  },
  "patch": [
    {
      "type": "spot",
      "id_range": [
        1,
        64
      ]
    }
  ],
  "layout": {
    "type": "generator",
    "generator": {
      "shape": "custom",
      "fixtures": [
        {
          "id": 1,
          "x": 0,
          "y": 200
        },
        {
          "id": 2,
          "x": -20,
          "y": 160
        },
        {
          "id": 3,
          "x": 0,
          "y": 160
        },
        {
          "id": 4,
          "x": 20,
          "y": 160
        },
        {
          "id": 5,
          "x": -40,
          "y": 120
        },
        {
          "id": 6,
          "x": -20,
          "y": 120
        },
        {
          "id": 7,
          "x": 0,
          "y": 120
        },
        {
          "id": 8,
          "x": 20,
          "y": 120
        },
        {
          "id": 9,
          "x": 40,
          "y": 120
        },
        {
          "id": 10,
          "x": -60,
          "y": 80
        },
        {
          "id": 11,
          "x": -40,
          "y": 80
        },
        {
          "id": 12,
          "x": -20,
          "y": 80
        },
        {
          "id": 13,
          "x": 0,
          "y": 80
        },
        {
          "id": 14,
          "x": 20,
          "y": 80
        },
        {
          "id": 15,
          "x": 40,
          "y": 80
        },
        {
          "id": 16,
          "x": 60,
          "y": 80
        },
        {
          "id": 17,
          "x": -80,
          "y": 40
        },
        {
          "id": 18,
          "x": -60,
          "y": 40
        },
        {
          "id": 19,
          "x": -40,
          "y": 40
        },
        {
          "id": 20,
          "x": -20,
          "y": 40
        },
        {
          "id": 21,
          "x": 0,
          "y": 40
        },
        {
          "id": 22,
          "x": 20,
          "y": 40
        },
        {
          "id": 23,
          "x": 40,
          "y": 40
        },
        {
          "id": 24,
          "x": 60,
          "y": 40
        },
        {
          "id": 25,
          "x": 80,
          "y": 40
        },
        {
          "id": 26,
          "x": -100,
          "y": 0
        },
        {
          "id": 27,
          "x": -80,
          "y": 0
        },
        {
          "id": 28,
          "x": -60,
          "y": 0
        },
        {
          "id": 29,
          "x": -40,
          "y": 0
        },
        {
          "id": 30,
          "x": -20,
          "y": 0
        },
        {
          "id": 31,
          "x": 0,
          "y": 0
        },
        {
          "id": 32,
          "x": 20,
          "y": 0
        },
        {
          "id": 33,
          "x": 40,
          "y": 0
        },
        {
          "id": 34,
          "x": 60,
          "y": 0
        },
        {
          "id": 35,
          "x": 80,
          "y": 0
        },
        {
          "id": 36,
          "x": 100,
          "y": 0
        },
        {
          "id": 37,
          "x": -120,
          "y": -40
        },
        {
          "id": 38,
          "x": -100,
          "y": -40
        },
        {
          "id": 39,
          "x": -80,
          "y": -40
        },
        {
          "id": 40,
          "x": -60,
          "y": -40
        },
        {
          "id": 41,
          "x": -40,
          "y": -40
        },
        {
          "id": 42,
          "x": -20,
          "y": -40
        },
        {
          "id": 43,
          "x": 0,
          "y": -40
        },
        {
          "id": 44,
          "x": 20,
          "y": -40
        },
        {
          "id": 45,
          "x": 40,
          "y": -40
        },
        {
          "id": 46,
          "x": 60,
          "y": -40
        },
        {
          "id": 47,
          "x": 80,
          "y": -40
        },
        {
          "id": 48,
          "x": 100,
          "y": -40
        },
        {
          "id": 49,
          "x": 120,
          "y": -40
        },
        {
          "id": 50,
          "x": -140,
          "y": -80
        },
        {
          "id": 51,
          "x": -120,
          "y": -80
        },
        {
          "id": 52,
          "x": -100,
          "y": -80
        },
        {
          "id": 53,
          "x": -80,
          "y": -80
        },
        {
          "id": 54,
          "x": -60,
          "y": -80
        },
        {
          "id": 55,
          "x": -40,
          "y": -80
        },
        {
          "id": 56,
          "x": -20,
          "y": -80
        },
        {
          "id": 57,
          "x": 0,
          "y": -80
        },
        {
          "id": 58,
          "x": 20,
          "y": -80
        },
        {
          "id": 59,
          "x": 40,
          "y": -80
        },
        {
          "id": 60,
          "x": 60,
          "y": -80
        },
        {
          "id": 61,
          "x": 80,
          "y": -80
        },
        {
          "id": 62,
          "x": 100,
          "y": -80
        },
        {
          "id": 63,
          "x": 120,
          "y": -80
        },
        {
          "id": 64,
          "x": 140,
          "y": -80
        }
      ]
    }
  },
  "groups": [
    {
      "id": "all",
      "name": "All",
      "fixtures": {
        "range": [
          1,
          64
        ]
      },
      "sort_by": "none"
    },
    {
      "id": "byydesc",
      "name": "ByYDesc",
      "fixtures": {
        "range": [
          1,
          64
        ]
      },
      "sort_by": "-y"
    },
    {
      "id": "byx",
      "name": "ByX",
      "fixtures": {
        "range": [
          1,
          64
        ]
      },
      "sort_by": "x"
    }
  ],
  "phasers": [
    {
      "id": "pyramid_climb",
      "name": "Pyramid Climb",
      "target": "byydesc",
      "multiplier": 1,
      "steps": [
        {
          "values": {
            "color": "#ffaa00",
            "dimmer": 1
          },
          "width": 20,
          "transition": 50
        },
        {
          "values": {
            "color": "#000000",
            "dimmer": 0
          },
          "width": 80,
          "transition": 100
        }
      ],
      "phase": {
        "mode": "spread",
        "spread": {
          "from": 0,
          "to": 100
        }
      }
    },
    {
      "id": "side_split",
      "name": "Side Split",
      "target": "byx",
      "multiplier": 0.5,
      "steps": [
        {
          "values": {
            "color": "#00ffcc",
            "tilt": -30
          },
          "width": 50,
          "transition": 100
        },
        {
          "values": {
            "color": "#ff00ff",
            "tilt": 30
          },
          "width": 50,
          "transition": 100
        }
      ],
      "phase": {
        "mode": "spread",
        "spread": {
          "from": 0,
          "to": 50
        }
      }
    }
  ],
  "timeline": {
    "events": []
  }
}
