{
  "schema_version": 1,
  "meta": {
    "name": "Lissajous Knot"
  },
  "patch": [
    {
      "type": "spot",
      "id_range": [
        1,
        120
      ]
    }
  ],
  "layout": {
    "type": "generator",
    "generator": {
      "shape": "formula",
      "formula": {
        "x": "sin(3 * t + 1.5708)",
        "y": "sin(2 * t)",
        "t_range": [
          0,
          6.283185
        ],
        "count": 120,
        "scale": 150
      }
    }
  },
  "groups": [
    {
      "id": "all",
      "name": "All",
      "fixtures": {
        "range": [
          1,
          120
        ]
      },
      "sort_by": "none"
    },
    {
      "id": "byy",
      "name": "ByY",
      "fixtures": {
        "range": [
          1,
          120
        ]
      },
      "sort_by": "y"
    }
  ],
  "phasers": [
    {
      "id": "snake_run",
      "name": "Snake Run",
      "target": "all",
      "multiplier": 1,
      "steps": [
        {
          "values": {
            "color": "#00aaff",
            "dimmer": 1
          },
          "width": 15,
          "transition": 100
        },
        {
          "values": {
            "color": "#aa00ff",
            "dimmer": 0.5
          },
          "width": 15,
          "transition": 100
        },
        {
          "values": {
            "color": "#000000",
            "dimmer": 0
          },
          "width": 70,
          "transition": 100
        }
      ],
      "phase": {
        "mode": "spread",
        "spread": {
          "from": 0,
          "to": 100
        }
      }
    },
    {
      "id": "y_axis_gradient",
      "name": "Y-Axis Gradient",
      "target": "byy",
      "multiplier": 0.5,
      "steps": [
        {
          "values": {
            "color": "#ff0088",
            "dimmer": 0.8
          },
          "width": 50,
          "transition": 100
        },
        {
          "values": {
            "color": "#ff8800",
            "dimmer": 0.8
          },
          "width": 50,
          "transition": 100
        }
      ],
      "phase": {
        "mode": "spread",
        "spread": {
          "from": 0,
          "to": 100
        }
      }
    }
  ]
}
